,appid,image_keywords
666,485510,"Nioh, video game, samurai, action, adventure, Complete Edition, Japan, feudal, warriors, katana"
667,486150,"radical, spectrum, volume, rainbow, text, black background"
668,48700,"warband, battle, legend, horseback, medieval, sword, horse, warrior, Mount&Blade"
669,48720,"warrior,fire,sword,armor,game"
670,488790,"South Park, video game, cartoon, Fractured but Whole"
671,488860,"video game, soldiers, guns, zombies, apocalypse"
672,489520,"minion masters, fantasy, game, cartoon, characters, minions, masters"
673,489630,"Warhammer, Gladius, Relics of War, sci-fi, fantasy, video game, orks, eldar, space marines"
674,489830,"The Elder Scrolls V, Skyrim, Special Edition, dragon, fantasy, video game"
675,490110,"police, cars, officer, crime, game, city"
676,491650,"sword, hill, reset, game over, pixel art"
677,4920,"sci-fi,video game,monster,alien,character,mask"
678,492720,"Tropico 6, video game, island, dictator, cartoon, military uniform"
679,493340,"rollercoaster, amusement park, theme park, Planet Coaster"
680,493490,"city, car, driving, game, video game"
681,493520,"video game, GTFO, horror, masks, red background"
682,494840,"uboat, submarine, war, naval, battle, aircraft, explosion"
683,49520,"video games, action, sci-fi, Borderlands 2, post-apocalyptic"
684,495420,"zombie,video game,post-apocalyptic,monster,horror"
685,495910,"gaming,online,anime,fantasy,female,video game"
686,496300,"kingdom, new lands, video game, horseback, adventure"
687,50,"gaming, Half-Life, soldier, gas mask"
688,500,"left4dead, game, zombies, gore, video game"
689,50130,"mafia,game,violence,men,suit"
690,501300,"book cover, silhouette, tower, mystery, Edith Finch"
691,502500,"fighter jet, aircraft carrier, Ace Combat 7, flight, clouds, military, aviation"
692,502520,"American Civil War, cannon, game, Ultimate General"
693,503940,"train, railway, empire, mountains, game"
694,504230,"video game, celeste, adventure, platformer, anime girl, strawberry, wings"
695,505460,"war, tank, soldiers, foxhole, warfare"
696,508290,"spaceship,ride,video game,pixel art,bitcoin"
697,508440,"battle, simulator, cartoon, medieval, fighting, characters, fantasy, war, game, TABS"
698,509980,"monster, Bigfoot, forest, creature, horror, Sasquatch"
699,512900,"video game, pixel art, rogue, action, adventure, streets"
700,513710,"violence,game,prisoner,blood,SCUM"
701,515570,"anime, girl, hat, dark, cyberpunk, illustration"
702,516750,"car, summer, vehicle, repair, game"
703,517630,"action,game,explosion,helicopter,video game"
704,517790,"Caesar, game, title, logo, III"
705,518150,"stealth, multiplayer, game, intruder, mask"
706,518790,"hunting, video game, forest, outdoors, adventure, theHunter Call of the Wild"
707,520440,"guilty gear, anime, fighting game, video game characters"
708,521890,"man,shovel,tree,bird,autumn,Hello Neighbor,game"
709,524220,"video game, action, androids, robots, battle, NieR:Automata"
710,524660,"chat,logo,text,speech bubble,black background"
711,526870,"factory,industrial,game,satisfactory"
712,527230,"fantasy, RPG, adventure, medieval, battle, For the King"
713,527430,"Warhammer, Inquisitor, Martyr, video game, sci-fi, futuristic, armor, fantasy"
714,528230,"game, action, robot, war, synthetik ultimate"
715,528740,"sci-fi, aliens, futuristic, game, operation new earth"
716,529340,"Victoria 3, game, advertisement, free trial, strategy"
717,531510,"game, music, shapes, beats, rhythm"
718,531640,"cowboy, gun, fantasy, hero, Eternal"
719,532110,"tree, roots, lake, red, mountains"
720,532210,"video game, Life is Strange 2, advertisement, BAFTA award, characters, promotional poster"
721,534380,"Dying Light 2, video game, zombie apocalypse, action, adventure, parkour"
722,535930,"game, hospital, doctors, Two Point Hospital"
723,536270,"monkeys, jungle, ancestors, evolution, apes"
724,537180,"Digimon, anime, cartoon, video game, characters, creatures"
725,537800,"bomber crew, game, cartoon, airplanes, pilots"
726,538030,"soldiers, guns, tactical, video game, XCOM"
727,538680,"anime, video game, Trails of Cold Steel, characters, swords, fantasy"
728,539720,"razor tron, neon, car, woman, futuristic"
729,541210,"ship, war, naval, battle, cold waters"
730,541300,"survival,horror,zombie,game,Survive the Nights"
731,541570,"Sally Face, cartoon characters, creepy, horror, video game, animation"
732,544550,"space, astronaut, game, Stationeers"
733,544730,"Catan, universe, game, fantasy, board game"
734,544750,"Soulcalibur VI, swords, warriors, fighting, video game, action, battle"
735,544810,"cards, game, world war, bullets, military, strategy"
736,546560,"video game, Half-Life, Alyx, ruins, destruction"
737,548430,"dwarves, mining, guns, adventure, sci-fi, fantasy, action, video game"
738,550,"video games, zombies, Left 4 Dead 2"
739,550470,"fantasy,fire,woman,dragon,game,Nostale"
740,550650,"soldiers, guns, tactical, game, Black Squad"
741,551170,"anime, characters, Onmyoji"
742,55150,"Warhammer, Space Marine, Anniversary Edition, video game, sci-fi, armor, sword"
743,552100,"truck, airplane, lego, BrickRigs"
744,55230,"video game, Saints Row, action, adventure, Xbox, PlayStation"
745,552500,"Warhammer, Vermintide, fantasy, action, video game, medieval, armor, fire"
746,552520,"video game, Far Cry 5, church, landscape, action, adventure, open-world, mountains, trees, fire, helicopter"
747,552990,"Star Trek, World of Warships, collaboration, ships, characters"
748,553420,"video game, cartoon, fox, sword, shield, forest, Tunic"
749,553520,"train, train simulator, video game, Rocky Mountaineer"
750,553790,"drama, mystery, thriller"
751,553850,"video game, Helldivers 2, action, sci-fi, futuristic, battle, aliens, spaceships, fantasy, adventure, democracy"
752,555160,"shooter,game,pavlov,gun,violence"
753,555570,"zombie apocalypse, video game, infestation, post-apocalyptic, zombies"
754,558990,"puzzle,game,magnum,opus,video game"
755,560130,"video game, fantasy, battle, adventure, sword, warriors, skull"
756,562360,"planes, bullets, vodka, aircraft, red background, cartoon style"
757,563560,"sci-fi,action,video game,shooting,futuristic"
758,56400,"Warhammer, Dawn of War, Retribution, video game, fantasy, character, armor, swords, dark, red, flames"
759,564230,"wrestling,fire,game,gaming,pro-wrestling"
760,567630,"sword, woman, warrior, anime, blood of steel"
761,567640,"Danganronpa, anime, video game, Killing Harmony, V3"
762,568220,"Lobotomy Corporation, anime, horror, video game, logo"
763,569480,"kingdoms,castles,dragon,gaming,update,video game"
764,570,"DOTA 2, fantasy, characters, heroes, warriors, game"
765,570940,"dark souls, remastered, armor, knight, fire, dark, fantasy"
766,571310,"SteamWorld, video game, cartoon, robot, mining, adventure, sci-fi, fantasy"
767,571740,"golf, game, entertainment, video game, golf it"
768,572890,"pikuniku, cartoon, game, characters, colorful"
769,573090,"helicopter, game, update, stormworks, sailing"
770,573100,"battlefleet gothic, video game, sci-fi, space battle, futuristic, ships"
771,575720,"game, bird, armor, fantasy, cards"
772,578080,"PUBG, Battlegrounds, soldiers, battle, war, fighting, guns, game"
773,578330,"Lego, City Undercover, video game, character, blue background"
774,578650,"space, adventure, video game, sci-fi, fantasy, exploration, futuristic"
775,581320,"insurgency, sandstorm, soldier, gun, new operation"
776,582010,"monster hunter world, dragon, hunter, action, fantasy, game"
777,582160,"Assassin's Creed Origins, pyramid, sphinx, Egypt, video game"
778,582500,"survival,horror,winter,snow,game"
779,582660,"action, fantasy, game, armor, sword, knight, battle, adventure, medieval, Black Desert"
780,584400,"Sonic, Mania, video game, characters, yellow background"
781,585420,"videogame,trailmakers,explosion,action,adventure,robot,character"
782,586140,"anime, BlazBlue, video game, characters, fantasy"
783,586200,"Street Fighter, 30th Anniversary Collection, fighting, characters, video game, anniversary"
784,586350,"punk rock, musician, mask, black background, red accents, spiked mask, Corey Taylor, Slipknot"
785,588030,"train, simulator, derail valley, game, locomotive"
786,588430,"video game, Fallout Shelter, cartoon, vault, people"
787,588650,"action,roguelike,video game,Dead Cells,fantasy,rogue-lite"
788,589290,"war, soldiers, historical, strategy, Holdfast, battle, update, game"
789,589590,"kindergarten, children, parents, teachers, pixel art, school"
790,590380,"robot, city, mecha, video game, sci-fi, futuristic"
791,593600,"pixark, dinosaurs, cartoon, video game"
792,594570,"Total War, Warhammer 2, fantasy, strategy, game, dragon, knight, battle, medieval, mythology"
793,594650,"hunting,game,violence,western,action"
794,595520,"video game, Final Fantasy XII, airship, fantasy, clouds, blue sky"
795,597170,"clone drone, danger zone, 3D, action, video game, robots, battle"
796,597180,"war, battle, medieval, strategy, old world, army, city, siege"
797,597220,"cowboy, gun, beer, west, loathing, desert"
798,599140,"graveyard,keeper,games,video game,skeleton,donkey,shovel,horror,cartoon,comedy,funny,death,undead,creepy,spooky,fun,entertainment"
799,599390,"battle,map,shield,swords,fantasy,game"
800,600750,"Star Trek,spaceships,space battle,futuristic,sci-fi,game"
801,601050,"anime, titans, monsters, action, fighting, Attack on Titan 2"
802,601150,"video games, action, Devil May Cry 5, fantasy, demons"
803,601430,"horror, video game, survival, The Evil Within 2"
804,601510,"Yu-Gi-Oh, anime, duel, links, game, characters"
805,601840,"sci-fi,video game,fantasy,characters,action,adventure,animation,combat,futuristic,space,robots,aliens,swords,shooter,hero,team,mission,quest,Griftlands"
806,6020,"Star Wars, Jedi Knight, Jedi Academy, game, video game"
807,602320,"train, city, tracks, yellow, train valley 2"
808,602960,"sci-fi,video game,horror,underwater,Barotrauma"
809,603850,"game, map, strategy, world, history"
810,604500,"tank, war, battle, force, game, military, army, combat"
811,605740,"emergency services, police, fire, badge, flashing lights"
812,6060,"Star Wars, Battlefront II, clone trooper, lightsabers, battle scene"
813,606150,"video game, demo, adventure, action, fantasy, moonlighter2"
814,607080,"psychonauts,video game,character,monster,forest,magic,supernatural,psychedelic,artwork"
815,610080,"game, castle, pixel art, fantasy, strategy"
816,610180,"party games, Jackbox, multiplayer, video games, gaming"
817,610370,"western,desperados,game,action,adventure,gunfight,cowboy"
818,611150,"anime,girls,game,art,yellow,Your Sisters"
819,611500,"Quake, Champions, game, logo, red, silver, black"
820,611670,"The Elder Scrolls V: Skyrim, VR, fantasy, sword, game"
821,611790,"party, game, DLC, people, characters, house"
822,612020,"zombies, grim reaper, cartoon, zombies apocalypse, fighting, video game"
823,612880,"video game, Wolfenstein, action, shooter, FPS, Bethesda"
824,613100,"construction, renovation, house, blueprint, hammer, hardhat"
825,613830,"Chrono Trigger, video game, characters, RPG, anime, fantasy"
826,616720,"software, viewer, Live2D, colorful, graphic design"
827,617290,"post-apocalyptic, video game, Remnant, action, survival, ruins, destruction, gun, hat, ashes"
828,619820,"Heroes of Hammerwatch II, game, fantasy, strategy, video game, title screen"
829,620,"portal,robot,game,video game,portal 2"
830,620980,"beat saber, neon, red, blue, game"
831,621060,"PC building simulator, computer parts, IT expansion"
832,621830,"racing, car, wrc, game, rally, video game, dirt, speed, action, adventure"
833,625960,"game, Stone Shard, medieval, fantasy, camp, castle"
834,627270,"superhero,superman,fighting,video game,Injustice 2"
835,627690,"idle champions, Dungeons & Dragons, video game, character, logo"
836,628050,"video game,romance of the three kingdoms,characters,warriors,simulation"
837,628060,"warriors, swords, battle, armor, men, japanese, characters"
838,628070,"Romance of the Three Kingdoms, video game, Japanese text, characters, historical figures, warriors, strategy game"
839,628080,"game, characters, warriors, swords, video game, Romance of the Three Kingdoms"
840,628890,"Nobunaga's Ambition, Taishi, samurai, sword, Japan, video game, strategy"
841,629520,"soundpad,headphones,audio,software,red,logo"
842,629730,"VR, fantasy, sword fighting, sorcery, magic, game"
843,629760,"medieval,warrior,sword,shield,armor,game"
844,629820,"shark, video game, action, horror, man-eater"
845,631510,"Devil May Cry, HD Collection, video games, action, anime"
846,632300,"hobo, homeless, fire, survival, rough"
847,632360,"video game, Risk of Rain 2, characters, action, adventure, fantasy"
848,632470,"Disco Elysium, video game, sci-fi, RPG, fantasy, adventure"
849,632810,"soundpad,demo,audio,software"
850,633230,"Naruto, Boruto, Shinobi Striker, anime, fighting game"
851,635260,"cars, drifting, racing, game, update"
852,636150,"cyberpunk,spaceship,futuristic,science fiction,video game"
853,636480,"game, soldiers, desert, plane, ravenfield"
854,637090,"sci-fi,robots,fighting,mech,video game"
855,637650,"Final Fantasy, video game, sword, Windows Edition"
856,638970,"Yakuza, video game, characters, men, suits, red background"
857,640380,"glitch,art,video game,sci-fi,futuristic"
858,640820,"Pathfinder, Kingmaker, fantasy, RPG, video game, Enhanced Plus Edition, characters, action, adventure. 
Pathfinder Kingmaker, fantasy RPG, video game, action, adventure, characters, Enhanced Plus Edition"
859,641320,"cooking, simulator, knife, vegetables, game"
860,641990,"prison,escape,game,videogame,The Escapists 2"
861,644560,"anime, girl, sword, mask, window, cherry blossoms"
862,644930,"steampunk, zombies, strategy, game, apocalypse"
863,645260,"fishing, game, fish, boat, sea"
864,645630,"cars, garage, repair, simulator, game"
865,646570,"action,game,adventure,video game,Slay the Spire,cards,rogue-like,deck-builder,fantasy,character,armor,sword,fire,explosion."
866,646910,"racing, car, The Crew 2, Ubisoft, game cover"
867,647830,"Lego, Marvel, Superheroes, 2, Captain America, Thor, Hulk"
868,647960,"pixelated, video game, warfare, ships, battle, water, pixel art"
869,648100,"Raging Loop, anime, manga, characters, video game"
870,648350,"Jurassic World, dinosaur, game, Evolution, T-Rex"
871,648800,"raft,shark,boat,survival,game"
872,653530,"video game, pirate ship, Obra Dinn, Return of the Obra Dinn"
873,654890,"American Civil War, game, Grand Tactician, history, strategy"
874,655500,"motorcross, dirt bikes, racing, MX Bikes"
875,656350,"mining,adventure,game,undermine,cartoon,characters"
876,65800,"game, Dungeon Defenders, cartoon, character, sword"
877,658850,"game, monkeys, security camera, pizza"
878,65980,"Civilization, Beyond Earth, space, game, sci-fi"
879,663090,"anime, sword, fantasy, magic, characters"
880,665300,"pixel art,stream avatars,video games,gaming,streaming"
881,666140,"farming,video game,animation,cartoon,my time at portia"
882,666150,"dinosaurs,prehistoric kingdom,game,logo,jurassic,prehistory,fantasy,simulation"
883,666860,"video game, quest, bit heroes, medieval, fantasy, adventure, pixel art, shield, sword, knight"
884,667970,"fighter jets, virtual reality, VTOL VR, aircraft, military simulation"
885,668580,"video game,Atomic Heart,post-apocalyptic,futuristic,sci-fi,action"
886,669330,"robot, mecha, game, mechabellum, battle, futuristic"
887,670290,"billiards, pool table, game, 3D simulation"
888,671860,"war, battle, soldier, tank, game, remastered"
889,672680,"war, strategy, 1942, supremacy, game, map, soldiers, flag"
890,672870,"widgets, wallpaper, appdrawer, screenplay"
891,673610,"airport, airplane, CEO, management, aviation, clouds"
892,673750,"game, bunny, cartoon, platformer, characters"
893,673880,"Warhammer, sci-fi, robots, Mechanicus, battle, futuristic, space marines"
894,673950,"farming,game,tractor,cartoon,farm,agriculture"
895,674140,"cartoon,game,bugs,adventure,characters"
896,674940,"stick fight, game, fighting, stickmen, cartoon"
897,675010,"trucks,mud,racing,off-road,game"
898,677120,"video game, pixel art, title screen, Heroes of Hammerwatch"
899,677620,"splitgate, video game, futuristic, action, sci-fi"
900,678800,"zombie, game, sas, assault"
901,678950,"Dragonball FighterZ, anime, fighting game, action, cartoon"
902,678960,"anime,game,action,fantasy,characters,Code:Vein"
903,679900,"game,sword,fantasy,adventure,video game"
904,680420,"sci-fi,action,video game,Outriders,post-apocalyptic,fantasy,characters,gun,violence"
905,681280,"mountain biking, descenders, extreme sports, freeriding, video game"
906,683320,"blue hair, crying, anime, girl, tears, sad, blue background"
907,683900,"rollercoaster, tycoon, classic, game, amusement park"
908,684450,"apocalypse, survival, destruction, disaster, aftermath"
909,6860,"Hitman, Blood Money, video game, assassin, suit"
910,686810,"war, planes, explosions, Hell Let Loose, soldier, battle, game, destruction, chaos, warfare"
911,688420,"Vikings,game,warriors,masks,Bad North"
912,688470,"warrior, armor, horse, moon, night, clouds, battle, chinese characters"
913,690640,"game, fantasy, adventure, Trine 4, Nightmare Prince"
914,690790,"racing, dirt, rally, subaru, car, game, video game"
915,690830,"village,windmill,game,foundation,building,cartoon"
916,6910,"Deus Ex, video game, cyberpunk, futuristic, Adam Jensen"
917,692850,"video games, Bloodstained, Ritual of the Night, anime, gothic, dark art"
918,692890,"robots,fighting,futuristic,action,game,robot battle,cyberpunk,animation,video game"
919,694280,"zombies,video game,horror,undead,warfare"
920,698780,"Doki Doki Literature Club, anime girl, heart, pink background, school uniform"
921,699130,"video game, zombies, apocalypse, Las Vegas, action, adventure"
922,699170,"fantasy,adventure,game,characters,sword,fellseal"
923,70,"gaming, Half-Life, video game, Gordon Freeman"
924,700330,"gaming, video game, secret laboratory, tooth & nail"
925,700600,"evil genius, video game, world domination"
926,701160,"fantasy,game,illustration,fantasy art,video game"
927,701470,"glitch,art,distorted,man,head,eye,black,background,pink,letters"
928,702320,"battle,warriors,medieval,army,castle,knights,swords,shields,battlefield,flags"
929,703080,"zoo, lions, video game, animals"
930,704270,"robots, war, action, futuristic, battle"
931,704450,"Neverwinter Nights, fantasy, RPG, video game, Enhanced Edition"
932,704850,"thief, simulator, house, night, burglar"
933,705210,"game, cube, racer, crown, racing"
934,707010,"zombie,game,free,apocalypse,horror,post-apocalyptic"
935,712100,"war, strategy, game, kings, medieval, Britain"
936,71250,"Sonic, Adventure, DX, Director's Cut, Dreamcast, Collection, video game"
937,714010,"AIMLABS, eggs, explosion, logo, teal, dark background"
938,718670,"cult,simulation,game,video game,doomsday cult,cultist simulator"
939,718850,"sci-fi,space,game,video game,fantasy,futuristic,planet,warrior,robots,aliens"
940,719040,"post-apocalyptic, video game, Wasteland 3, guns, armor, gas mask"
941,719640,"tanks, war, battle, explosions, destruction, military, game"
942,719890,"dinosaurs, Bermuda, triangle, pterodactyls, island"
943,720620,"gaming, dice, Tale Spire, logo, role-playing"
944,72850,"gaming, fantasy, action, adventure, Skyrim, Elder Scrolls"
945,728530,"SD Gundam G Generation, Cross Rays, video game, Gundam"
946,728880,"cooking, cartoon, game, video game, Overcooked2"
947,729040,"video games, action, post-apocalyptic, Borderlands, mask, explosions"
948,730,"counter strike 2, gaming, fps, video game, cs2"
949,731490,"Crash Bandicoot, video game, platformer, cartoon, adventure"
950,739630,"horror,game,title,screen,phasmophobia"
951,753,"Steam, logo, gaming, black, white"
952,7600,"train, railroad, game, sid meier's railroads"
953,7620,"train, railroad, tycoon, game, steam engine, locomotive"
954,78000,"game,bejeweled,jewel,puzzle,match-3"
955,7940,"Call of Duty, Modern Warfare, soldier, war, military, game, action, video game, combat, helicopter"
956,80,"Counter Strike, guns, masks, terrorists, game cover"
957,814380,"action, samurai, game, sekiro, shadows die twice, japanese architecture, fire, sword"
958,8190,"action,explosion,game,just cause 2,video game"
959,8500,"gaming, Eve Online, free to play, sci-fi, video game, space, futuristic"
960,8800,"Civilization, video game, sci-fi, futuristic, strategy"
961,8870,"video games, Bioshock Infinite, woman, shocked expression, game logo"
962,892970,"Valheim, Viking, campfire, survival, Norse, fantasy, adventure, game, Nordic, mythology"
963,8930,"Civilization V, strategy, war, historical, game, Sid Meier"
964,8980,"video,game,borderlands,action,shooter,characters"
965,899770,"Last Epoch, Tombs of the Erased, Season 2, video game, fantasy, RPG, action, adventure"
966,9420,"supreme commander, video game, mechs, robots, sci-fi, futuristic"
967,9450,"Warhammer, Dawn of War, Soulstorm, fantasy, war, battle, armor, sword, female warrior. 
No, 
Warhammer,Dawn of War,Soulstorm,fantasy,war,battle,armor,sword,female warrior"
968,945360,"Among Us, cartoon characters, space, multiplayer game, social deduction"
969,9480,"video games, Saints Row 2, guns, action, adventure"
970,9880,"superheroes, action, game, Champions Online, characters, cityscape"
971,9900,"Star Trek, online game, science fiction, characters, spaceship"
972,990080,"Hogwarts, magic, fantasy, wizard, game, legacy, castle, flying"
973,99900,"video game, Spiral Knights, characters, robots, futuristic"
974,99910,"pirates, puzzle, cartoon, sea, ships, battle, game"
