,appid,image_keywords
0,10,"Counter Strike, guns, masks, shooters, video game"
1,10090,"soldier,gun,war,game,Call of Duty"
2,10150,"video game, Prototype, action, sci-fi, black and red, hoodie, sword"
3,10180,"Call of Duty, Modern Warfare 2, soldier, gun, explosion, war, game"
4,10500,"Total War, Empire, game, strategy, war, history, definitive edition"
5,105600,"pixel art,terraria,video game,gaming,characters,trees,forest,grass,2d art,game title screen"
6,1063730,"New World Aeternum, game, fantasy, adventure, video game, Aeternum, New World"
7,10680,"Aliens, Predator, movie, sci-fi, horror, action, monsters, creatures"
8,107410,"Arma 3, soldier, military, war, game, action, combat, tactical, shooter, video game, helicopter, warfare, operation, mission, armed forces, army"
9,1085660,"Destiny 2, logo, video game, sci-fi, fantasy, gaming"
10,108600,"zombies, survival, horror, video game, zombies apocalypse"
11,1086940,"Baldur's Gate 3, fantasy, characters, swords, adventure, role-playing game, RPG, video game, characters with swords"
12,108710,"video game, Alan Wake, gun, flashlight, thriller, action"
13,1091500,"cyberpunk, video game, futuristic, 2077"
14,109600,"Neverwinter,Red Harvest,fantasy,game,dungeons,dragons"
15,1097150,"colorful, cartoon, characters, game, Fall Guys"
16,11020,"racing,car,game,TrackMania Nations Forever,TMNF"
17,110800,"video game, L.A. Noire, detective, women, gun, noir, crime, investigation"
18,1116170,"cyberpunk, robot, gun, cityscape, futuristic, combat"
19,113200,"roguelike,video game,horror,cartoonish,monsters,The Binding of Isaac"
20,113400,"APB Reloaded, video game, characters, tattoos, guns"
21,115320,"video game, Prototype 2, action, adventure, sci-fi"
22,1172470,"Apex Legends, video game, anime art, guns, weapons"
23,1174180,"cowboy, gun, western, game, red, dead, redemption"
24,1203220,"Naraka Bladepoint, Persona 5 Royal, anime, video games, crossover"
25,12200,"video game, bullying, scholarship edition, bully"
26,12210,"Grand Theft Auto, GTA IV, Liberty City, video game, characters"
27,1222670,"The Sims 4, video game, simulation, cartoon characters, diverse people"
28,1238810,"battlefield,game,video game,war,action"
29,1240440,"Halo, video game, multiplayer, armor, explosion, fire, sparks"
30,1245620,"Elden Ring, game, fantasy, ring, dark, mystical"
31,1250,"horror, zombies, survival, game, killing floor"
32,1326470,"survival,game,horror,video game,sons of the forest"
33,1491000,"robots,war,frontiers,lightning,mechs,futuristic,battlefield"
34,15100,"assassin's creed, video game, action, adventure, stealth"
35,15170,"Might and Magic Heroes V, fantasy, game, armor, knight, dragons"
36,1517290,"battlefield, war, soldiers, guns, action, fighting, video game, battle, destruction, chaos"
37,15370,"Might and Magic, Heroes V, video game, fantasy, battle, warriors, strategy"
38,15620,"Warhammer, Dawn of War, Anniversary Edition, video game, futuristic armor"
39,1599340,"video game, Lost Ark, characters, fantasy, action, adventure, RPG, characters posing"
40,1623730,"Palworld, creatures, fantasy, adventure, creatures, guns, battle, game, monsters, characters"
41,1665460,"eFootball, football, soccer, Lionel Messi, video game"
42,16700,"war,castle,crusade,knight,medieval,battle,game,stronghold"
43,16810,"Civilization IV Colonization, Sid Meier, game, colonization, soldiers, historical"
44,16900,"tactical,gun,video game,Ground Branch,rifle"
45,17390,"Spore, video game, creatures, space, sci-fi, fantasy"
46,17470,"horror, sci-fi, video game, Dead Space, space, zombies, necromorphs"
47,17480,"command and conquer, red alert 3, video game, woman, gun, robots, futuristic"
48,1811260,"FIFA 23, women's soccer, video game, Sam Kerr, Australia, New Zealand"
49,1840,"video editing software, filmmaking, source filmmaker"
50,18500,"robots,war,futuristic,game cover,Defense Grid,PC Gamer"
51,1938090,"soldier, gun, Call of Duty, video game, action, war, military, tactical, combat"
52,1966720,"lethal company, red, glitch art, distorted text, error, corrupted data"
53,19680,"dark,violent,alice,madness,returns,bloody,knife,game"
54,19900,"action,game,violence,explosion,warfare"
55,20,"game,Team Fortress,action,gun,video game"
56,200170,"Worms, Revolution, game, cartoon, level editor"
57,200210,"gaming, fantasy, knight, armor, game title"
58,200260,"Batman, Arkham City, Game of the Year Edition, video game, superhero"
59,200510,"sci-fi,video game,blue tone,futuristic,armed soldiers"
60,200710,"action,game,video game,torchlight,torchlight II,fantasy,role-playing game,RPG,diablo-like,ARPG,character,armor,fire,flames,logo,title screen,header"
61,201230,"EverQuest, video game, dragon, fantasy, free to play"
62,201810,"wolfenstein, video game, soldier, guns, nazis"
63,201870,"Assassin's Creed Revelations, video game, hooded figures, action, adventure"
64,202970,"Call of Duty, Black Ops II, gun, soldier, black and white, video game"
65,203140,"Hitman, video game, action, stealth, assassin, red, suit, gun"
66,203160,"Tomb Raider, Lara Croft, action, adventure, video game"
67,203290,"America's Army, soldier, military, game, proving grounds"
68,203770,"game, Crusader Kings II, free to play"
69,204100,"action,violence,game,Max Payne 3,shooter,thriller"
70,204300,"video game, cartoon, characters, awesomenauts"
71,204360,"video games, cartoon characters, side-scrolling beat-em-up, Castle Crashers"
72,204450,"cowboy, gunslinger, western, Call of Juarez, video game"
73,204880,"sci-fi,space,rebellion,futuristic,game"
74,205100,"stealth, action, video game, Dishonored, assassin, fantasy"
75,205710,"fantasy,game,video game,everquest,female warrior,gold lettering"
76,206420,"action,video game,violence,comedy,aliens,gun,shooting,explosion"
77,206440,"video game, moon, adventure, dog, man"
78,206480,"Dungeons & Dragons, zombies, fantasy, adventure, horror, gaming"
79,207140,"video games, cartoon characters, SpeedRunners, advertisement"
80,207610,"zombies,video game,post-apocalypse,horror,action,adventure,Telltale"
81,208580,"Star Wars, Knights of the Old Republic, Sith Lords, video game, sci-fi, action"
82,208650,"Batman,Arkham Knight,video game,action,adventure,DC Comics,superhero,fantasy"
83,20900,"action,video game,violence,fantasy,fighting,The Witcher"
84,209000,"Batman, Arkham Origins, video game, superhero"
85,209160,"Call of Duty, Ghosts, video game, action, shooter, soldier, mask, gloves"
86,20920,"gaming, fantasy, sword, The Witcher 2, action, adventure"
87,21000,"Lego,Batman,Robbin,videogame,game"
88,21090,"F.E.A.R., video game, horror, woman, fire"
89,210970,"puzzle,game,island,mystery"
90,21130,"Lego, Harry Potter, video game, wands, Hogwarts"
91,211500,"racing cars, raceroom, race cars, game, video game, racing game"
92,211820,"space,game,planets,sun,starbound"
93,212160,"game,advertisement,summer,vacation,beach,boost"
94,212200,"anime, video game, characters, Guild Renewal, 2025"
95,212480,"Sonic, racing, transformed, collection, video game, car, jet, boat"
96,212500,"warriors, battle, Lord of the Rings, swords, archers, fantasy, monsters"
97,212680,"space, planet, FTL, stars, galaxy"
98,212910,"Call of Duty, Black Ops II, Zombies, video game, gaming"
99,213330,"LEGO, Batman, Superheroes, DC, videogame"
100,213610,"Sonic,Shadow,adventure,gaming,videogames,characters,animation"
101,213670,"South Park, video game, The Stick of Truth, cartoon, fantasy"
102,214490,"Alien, Isolation, horror, sci-fi, video game"
103,214510,"Lego, Lord of the Rings, fantasy, adventure, characters, swords, bows"
104,214730,"space rangers, video game, HD, sci-fi, futuristic, robot, war, action, adventure"
105,214950,"Total War Rome II, Roman soldier, video game, strategy game, ancient Rome, Emperor Edition"
106,215080,"anime,elf,boy,fantasy,video game"
107,215100,"Ragnarok, anime, characters, video game, fantasy, characters, online game"
108,216150,"concert,stage,MapleStory,STARGazer,music,festival,characters,cartoon"
109,21690,"Resident Evil, horror, video game, logo, fire, red, orange"
110,217200,"Worms, Armageddon, video game, cartoon, nuclear, explosion"
111,218230,"Planetside 2, anniversary, video game, action, sci-fi, battle, robots, guns, futuristic"
112,218620,"video game, Payday 2, heist, robbery, crime, action, thriller, masked men"
113,2186680,"Warhammer, Rogue Trader, sci-fi, fantasy, video game"
114,219150,"video game,Hotline Miami,violence,action,Miami,retro art"
115,219740,"gaming,adventure,video game,DLC,Hamlet,Don't Starve"
116,219990,"action, adventure, Grim Dawn, dark, fantasy, video game, RPG, dark fantasy"
117,220,"gaming, Half-Life, video game characters, sci-fi"
118,220200,"space, Kerbals, astronauts, cartoon, Kerbal Space Program"
119,220240,"far cry 3, video game, action, adventure, tropical island"
120,220440,"action,video game,devil may cry,dmc"
121,220700,"RPG Maker, anime, game, characters, fantasy"
122,221040,"horror,video game,resident evil,virus,parasite"
123,221100,"DayZ,post-apocalyptic,warfare,survival,video game"
124,221380,"game, medieval, castle, knight, strategy, war, medieval era, black and white, Age of Empires III"
125,221680,"guitar, Rocksmith, video game, music, electric guitar"
126,222440,"fighting game, KOF 2002, anime characters, video game cover, King of Fighters"
127,222480,"horror, video game, Resident Evil, Revelations"
128,222880,"insurgency, soldiers, guns, masks, warfare"
129,22320,"The Elder Scrolls III: Morrowind, game, fantasy, video game, Morrowind, Game of the Year Edition"
130,22330,"The Elder Scrolls IV: Oblivion, game, armor, fire, castle, fantasy"
131,223470,"video game, gun, violence, dark, action, postal 2"
132,22370,"Fallout 3, video game, post-apocalyptic, action, RPG, game cover"
133,223710,"horror, fear, cry, dark, scary"
134,223750,"military,aircraft,tanks,warfare,simulation"
135,22380,"Fallout, New Vegas, video game, post-apocalyptic, sci-fi, RPG, action, adventure, gaming, Bethesda, post-apocalyptic world, futuristic, character, armor, gun, weapon, red sky, cityscape, silhouette, dramatic lighting, Bethesda Softworks. 
 Fallout, New Vegas, video game, post-apocalyptic, sci-fi, RPG, action, adventure, gaming is a more concise list: Fallout, New Vegas, video game, post-apocalyptic, sci-fi 
A more concise list is: Fallout,New Vegas,post-apocalyptic,sci-fi,video game"
136,223850,"gaming,benchmarking,3DMark,performance testing,video games"
137,224260,"zombies,horror,games,violence,blood,death,hell"
138,2246340,"Monster Hunter Wilds, video game, action, adventure, fantasy, monsters, hunters"
139,225540,"action,explosion,video game,Just Cause 3,man,gun,helicopter"
140,225840,"gaming, logo, sven co-op, half-life"
141,226840,"strategy, fantasy, game, medieval, video game, Age of Wonders III"
142,226860,"game, sci-fi, space, strategy, Galactic Civilizations III"
143,227300,"truck, simulator, game, scania, euro"
144,227320,"budget,rocket,finance,launch,money management"
145,2280,"Doom, video game, monsters, guns, action"
146,228180,"gaming, streaming, recording, red eye, action"
147,228200,"soldiers, war, game, Company of Heroes"
148,228280,"Baldur's Gate, video game, Enhanced Edition, expansion, RPG, fantasy"
149,228380,"cars, racing, destruction, game, Wreckfest"
150,230290,"universe, sandbox, planet, space, logo"
151,230410,"warframe, action, sci-fi, fantasy, video game, characters, battle"
152,2310,"gaming, Quake, logo, video game, dark background"
153,231120,"Euro Truck Simulator 2, truck, demo, game, simulation"
154,231350,"3dmark, logo, benchmark, graphics, performance"
155,231430,"war, soldiers, tanks, Company of Heroes 2, guns, battle, warfare"
156,2320,"Quake II, video game, dark, green, logo, horror"
157,232090,"zombies, guns, gas mask, blood, horror, Killing Floor 2"
158,232890,"crusader,stronghold,warrior,knight,game,medieval,crusade,armor,shield"
159,233450,"prison, architect, game, video game, prisoners"
160,233860,"sci-fi,fantasy,adventure,space,landscape"
161,234140,"movie,posters,action,thriller,adventure,post-apocalyptic"
162,234330,"Marvel, Puzzle Quest, superheroes, game, comic characters"
163,235460,"Metal Gear Rising, video game, action, revenge, cyborg, futuristic, sci-fi, violence, Raiden"
164,2358720,"video game, Black Myth Wukong, action, adventure, fantasy, mythology, Chinese culture, armor, warrior"
165,235900,"RPG, anime, fantasy, game development, RPG Maker"
166,236110,"action,video game,dungeon defenders,fantasy,characters,adventure"
167,236390,"War Thunder, fighter jet, Hornet's Sting, military, aircraft, combat, game, aviation"
168,236430,"dark souls, video game, dark fantasy, action, adventure"
169,236850,"strategy, Europa Universalis IV, video game, historical, grand strategy, Europa Universalis"
170,237310,"anime,gaming,event,advertisement,Elsword"
171,238010,"Deus Ex, video game, Human Revolution, Director's Cut, sci-fi, futuristic, action, adventure"
172,238090,"sniper, game, rifle, soldier, war"
173,238320,"horror, Outlast, video game, green, dark, eyes"
174,238460,"gaming, cartoon, action, adventure, battleblock, theater"
175,238960,"gaming, fantasy, Path of Exile, action, RPG"
176,239030,"Papers,Please,dystopian,thriller,document,game"
177,239140,"video game, zombies, Dying Light"
178,239160,"thief, hood, dark, game, stealth"
179,239350,"spelunky, cartoon, treasure, adventure, cave, mining, gold, monster, fantasy"
180,239820,"game development, Tycoon, arcade, video game, simulation"
181,240,"Counter Strike Source, video game, shooter, gun, mask, helmet"
182,24010,"trains, simulation, game, railway, transport"
183,240720,"game, rocks, man, sledgehammer, cauldron, mountains, trees"
184,241930,"Shadow of Mordor, Middle Earth, video game, fantasy, action, adventure"
185,24200,"superheroes, DC Universe, comic characters, fantasy, online game"
186,242050,"pirate,assassin,game,video game,black flag,assassin's creed"
187,242550,"Rayman Legends, video game, cartoon characters, platformer"
188,242680,"Nuclear Throne, cartoon characters, video game, monsters, creatures, music, guitar, skull, colorful"
189,242760,"movie,forest,mystery,thriller,horror"
190,242920,"village, game, medieval, river, Banished"
191,243470,"gaming, action, video game, watchdogs"
192,244160,"Homeworld, Remastered Collection, space, video game, stars"
193,244210,"racing,car,sports,game,simulation,red,Assetto Corsa"
194,244450,"war, tank, game, men, assault, squad"
195,244850,"space, engineers, fieldwork, update, sci-fi, futuristic, spaceship, astronaut"
196,245170,"skullgirls, cartoon, characters, video game, 2nd encore"
197,246420,"kingdom,rush,game,knights,castle,battle,fantasy,warriors,medieval,action"
198,246620,"plague, virus, game, red, biohazard"
199,246840,"magic, fantasy, game, fate, wizard, cloak"
200,246900,"horror, blood, warning, danger, gore"
201,247080,"rhythm, zombies, dancing, skeletons, adventure, cartoon, video game, necromancer, crypt"
202,24720,"Spore,galactic,adventures,expansion,game,space,fantasy,creatures,aliens"
203,24780,"city, simulation, game, deluxe, edition"
204,24790,"soldiers, guns, video game, Command & Conquer"
205,24800,"command and conquer, red alert 3, uprising, video game, strategy"
206,24810,"command,conquer,gaming,video game,action,strategy,warfare,fantasy,sci-fi,robots,fire,explosion,character,cover art,game cover"
207,248170,"software, logo, red, Clickteam, Fusion Standard"
208,248390,"gaming,crafting,adventure,game,craft the world"
209,248570,"toribash,game,logo,character,3d,fighting"
210,249050,"video game, fantasy, adventure, dungeon, endless"
211,249130,"Lego, Marvel, Superheroes, Deadpool, Captain America, Hulk, Iron Man, Lego minifigures, Comic book characters"
212,250320,"wolf,game,video game,werewolf,Telltale"
213,250520,"underground, subway, tunnel, action, thriller, survival, post-apocalyptic"
214,250760,"shovel knight, treasure trove, video game, cartoon characters, medieval theme"
215,250900,"video game, horror, The Binding of Isaac Rebirth, monsters, baby"
216,251060,"warfare,game,ships,aircraft,explosion"
217,251150,"anime,video game,Trails in the Sky,The Legend of Heroes"
218,251290,"anime,video game,characters,action,adventure,fantasy,swordfighting,clouds,airship"
219,251570,"zombies, survival, horror, game, 7 days to die"
220,251670,"hazmat suits, guns, battle, war, cartoon, gas mask, post-apocalyptic"
221,252410,"steampunk, cartoon, adventure, game, digging, fantasy"
222,252490,"rust, game, survival, video game, rust game"
223,252530,"buses, city, transport, simulation, game"
224,252610,"zombies, video game, pixel art, Canada"
225,252870,"space,game,aliens,futuristic,science fiction,adventure"
226,252950,"cars,racing,game,Rocket League,sports,video game"
227,253230,"video game, A Hat in Time, cartoon, adventure, platformer"
228,253250,"city-building, strategy, simulation, video game, StoneHearth II, isometric, 3D graphics"
229,253710,"hunting, deer, ducks, game, sunset"
230,254700,"horror, video game, Resident Evil, forest, survival"
231,255300,"robots,roaches,insects,creatures,game,journey of a roach"
232,255710,"city, game, simulation, skyscraper, transportation"
233,257350,"Baldur's Gate II, Enhanced Edition, video game, RPG, fantasy"
234,257510,"robot,cat,futuristic,science fiction,video game"
235,258970,"action,adventure,game,characters,fantasy,Gauntlet Slayer Edition"
236,259680,"fantasy,game,title screen,dark art,video game"
237,259810,"sheep, cartoon, farm, game, party, aliens"
238,2600,"vampire,game,darkness,horror,fantasy"
239,261030,"zombies,walking dead,video game,apocalypse,horror"
240,261550,"Mount&Blade II, Bannerlord, medieval, knight, horse, armor, battleaxe, video game, fantasy, warfare"
241,261570,"Ori, forest, adventure, fantasy, video game, platformer"
242,261640,"video game, sci-fi, action, Borderlands, The Pre-Sequel"
243,262060,"darkest dungeon, video game, rpg, gothic, fantasy"
244,262410,"gun, disassembly, pistol, ammunition, World of Guns"
245,2630,"war, soldiers, guns, Call of Duty 2"
246,264710,"underwater,scuba diving,submarine,ocean,game,fish,diver"
247,265550,"video game, zombies, apocalypse, action, survival, Dead Rising 3"
248,265930,"goat, simulator, game, grass, field"
249,266410,"racing, car, iRacing, speed, competition, motorsport"
250,266840,"mythology, game, greek, gods"
251,268050,"horror, survival, video game, barbed wire"
252,268400,"gold edition, darkworks, logo, game, video game"
253,268500,"XCOM 2, alien, skulls, video game, sci-fi, horror"
254,268650,"war,ships,fire,naval,battle,explosion"
255,268850,"EVGA, precision, X1, purple, logo, banner"
256,268910,"Cuphead, videogame, cartoon, characters, yellow background"
257,269210,"action,video game,hero siege,fantasy,characters,combat,violence,demons,zombies,undead"
258,2694490,"action,role-playing,gaming,Path of Exile,video game"
259,269770,"secrets of grindea, anime, sword, adventure, fantasy, game"
260,269950,"flight simulator, XPlane11, space background, video game, aviation"
261,270150,"soldiers, rifles, war, battle, fighting, guns, army, combat, warfare, violence"
262,270880,"American truck simulator, truck, simulation game, red truck, highway"
263,271590,"gaming, action, GTA 5, video game, Grand Theft Auto V"
264,273110,"gaming, zombies, guns, action, Counter Strike Nexon"
265,274170,"video game, Hotline Miami 2, cartoon, action, violence"
266,274190,"action,video game,comic,explosion,characters"
267,274520,"horror, dark, creature, monster, black and white, darkwood"
268,274940,"shark, ocean, depth, water, teeth, monster"
269,275850,"No Man's Sky, robots, space, video game, update"
270,276810,"Mordheim, fantasy, zombies, undead, warriors, battle, dark, city, game, video game"
271,278080,"warrior, sword, Dynasty Warriors 8, video game, action, fantasy"
272,280220,"Creeper World, video game, strategy, map, Arc Eternal"
273,280680,"Krita, art, digital painting, software, illustration, graphics"
274,281990,"space, sci-fi, video game, Stellaris"
275,282070,"war, mine, final cut, game, poster"
276,282140,"SOMA, video game, horror, sci-fi, dark atmosphere"
277,282440,"Quake, esports, gaming, logo, Quake Live"
278,282800,"anime,girls,orange juice,100%,cartoon,characters,action,shroom,spoon"
279,283640,"gothic,black,white,logo,game"
280,284160,"cars, racing, driving, BeamNG, game, vehicles"
281,285190,"Warhammer,Dawn of War III,video game,horror,fantasy,warfare"
282,285310,"rollercoaster, tycoon, deluxe, game, amusement park"
283,285330,"rollercoaster, tycoon, game, amusement park"
284,285900,"Gang Beasts, cartoon characters, colorful, playful, video game"
285,285920,"robots,vehicles,game,Terra Tech,fantasy,mechs,building,construction,blocks,cartoon,futuristic,science fiction,machines,technology,3D,video game"
286,286160,"tabletop, simulator, games, chess, cards, dice, poker chips"
287,286690,"gaming, post-apocalyptic, video game, metro, redux"
288,287290,"resident evil, video game, horror, survival, zombie"
289,287390,"Metro, Last Light, Redux, video game, post-apocalyptic, gas mask"
290,287450,"steampunk, strategy, game, fantasy, dragon, Rise of Nations"
291,287700,"Metal Gear Solid, stealth game, action, video game, The Phantom Pain"
292,287980,"Mini Metro, subway, game, transportation, logo"
293,288160,"mystery, horror, door, room, thriller"
294,288470,"Fable Anniversary, video game, Xbox 360, action RPG, fantasy, hero, sword, anniversary edition"
295,289070,"Civilization VI, Atlas, video game, strategy"
296,289130,"video game, castle, dragon, fantasy, Endless Legend"
297,289650,"Assassin's Creed Unity, video game, action, adventure, Assassin's Creed, Unity, game cover"
298,290340,"fantasy, animals, swords, Armello"
299,291480,"warface,clutch,warland park,video game,action,shooter"
300,291550,"Brawlhalla, anime, purple, action, fighting, game"
301,291650,"fantasy, video game, battle, warriors, Pillars of Eternity"
302,292000,"horror, video game, zombies, update"
303,292030,"The Witcher, video game, Geralt of Rivia, fantasy, action, adventure."
304,292120,"video games, Final Fantasy XIII, fantasy, anime, female warrior"
305,292730,"Call of Duty, Infinite Warfare, game, video game, gaming"
306,293760,"automation, game, tycoon, cars, company"
307,294100,"RimWorld, game, logo, planet, space"
308,294860,"valkyria chronicles, anime, war, guns, girls, soldiers"
309,296490,"game, fantasy, creatures, tower, shadows"
310,297000,"Might & Magic, Heroes III, HD Edition, knights, battle, medieval, strategy, game cover, fantasy, warriors"
311,29720,"Guild Wars, video game, fantasy, female character, blonde hair, blue eyes, dark attire, serious expression"
312,298030,"game, Total Annihilation, video game, title screen"
313,298050,"game, space, stars, orion, master, conquer"
314,298110,"videogames, mountains, guns, FarCry4, action"
315,30,"war, soldiers, defeat, army, battle, military"
316,300,"video game, soldiers, Day of Defeat, World War, Source engine"
317,301120,"hockey,game,manager,sport,ice rink"
318,301320,"roller coaster, simulation, game, amusement park, noLimits 2"
319,302510,"warrior, armor, battle, Ryse, Rome"
320,302670,"Call of Duty, soldier, fire, flames, gun, war, combat"
321,304050,"Trove, video game, Rising Tides, underwater scene, pixelated graphics, fantasy, adventure"
322,304240,"horror, mansion, video game, Resident Evil"
323,304390,"video game, swords, pirates, knights, action, For Honor, Defiance"
324,304410,"game, puzzle, hexagon, hexcells, infinite"
325,304430,"puzzle,platformer,game,inside,video game"
326,304930,"game, logo, Unturned, blue, text"
327,305620,"survival, wilderness, bear, sword, winter"
328,306020,"Bloons TD 5, cartoon, game, monkeys, balloons"
329,306130,"Elder Scrolls,online,gaming,fantasy,adventure,characters,horses,ruins,landscape"
330,307690,"action,video game,violence,man,blood"
331,307780,"Mortal Kombat X, Scorpion, fighting game, video game character"
332,307950,"action,game,violence,gunfight,shooting,warfare,combat,video game,Caliber"
333,307960,"planes,aircraft,WWII,airplanes,games,videogames"
334,310950,"Street Fighter, Ryu, fighting, video game, martial arts"
335,311210,"Call of Duty, Black Ops, video game, soldier, armor, futuristic"
336,311310,"ship, sea, naval, action, sailing, ocean, boat, clouds, sky, water, historical, battle, warship, vessel, pirate, naval action"
337,311340,"Metal Gear Solid V, stealth, Hideo Kojima, video game, tactical espionage"
338,311560,"Assassin's Creed Rogue, video game, action, adventure, Ubisoft"
339,311690,"gunplay,action,video game,characters,shooting,combat,violence,robots,aliens,fantasy,adventure,gungeon"
340,311770,"Lego,Pirates of the Caribbean,video game,Disney"
341,312060,"Final Fantasy XIV, online, free trial, video game, advertisement"
342,312450,"war, soldiers, battle, guns, World War II"
343,312520,"rain world, monster, slugcat, video game"
344,312530,"game, duck, casino, slots"
345,312660,"sniper,rifle,war,military,game"
346,312750,"final fantasy, 3D remake, video game"
347,313120,"survival, ocean, stranded, deep, sea"
348,313690,"Lego,Batman,game,video game,cover art,robot,space"
349,314160,"Microsoft, Flight Simulator X, Steam Edition, game, simulation"
350,314650,"space,engine,planet,stars,nebula"
351,315210,"Suicide Squad, video game, DC Comics, action, characters, anti-heroes"
352,315660,"train, steam engine, clouds, trainz, new era"
353,3164500,"cartoon, gun, cigarette, video game"
354,319510,"horror,game,animation,freddy's,terror"
355,319630,"video game, adventure, mystery, girl, polaroid, notebook"
356,320,"Half-Life, video game, deathmatch, action, sci-fi, multiplayer, FPS, gaming"
357,321960,"Might & Magic Heroes VII, fantasy, video game, phoenix, mountains"
358,322170,"geometry dash, video game, pixel art, obstacles, platformer"
359,322330,"cartoon,robot,vampire,video game,DLC,Don't Starve Together"
360,323190,"gaming,video game,announcement,frostpunk"
361,32330,"Lego, Indiana Jones, adventure, video game, cartoon"
362,323470,"dragonball, xenoverse, game, anime"
